{
  "format": "riglab.anim",
  "version": 3,
  "name": "unarmed-attack",
  "rig": "chibi",
  "class": "unarmed",
  "kind": "attack",
  "fps": 60,
  "length": 24,
  "loop": false,
  "keys": [
    {
      "frame": 0,
      "interpolation": "smoothstep",
      "pose": {
        "pelvis": {
          "x": 0,
          "y": 0,
          "rotation": 0
        },
        "leg-front": {
          "rotation": 0
        },
        "shin-front": {
          "rotation": 0
        },
        "leg-back": {
          "rotation": 0
        },
        "shin-back": {
          "rotation": 0
        },
        "torso": {
          "rotation": 0
        },
        "arm-front": {
          "rotation": 0
        },
        "forearm-front": {
          "rotation": 0
        },
        "arm-back": {
          "rotation": 0
        },
        "forearm-back": {
          "rotation": 0
        },
        "head": {
          "rotation": 0
        }
      }
    },
    {
      "frame": 8,
      "interpolation": "smoothstep",
      "pose": {
        "pelvis": {
          "x": 0,
          "y": 0,
          "rotation": 0
        },
        "leg-front": {
          "rotation": 0
        },
        "shin-front": {
          "rotation": 0
        },
        "leg-back": {
          "rotation": 0
        },
        "shin-back": {
          "rotation": 0
        },
        "torso": {
          "rotation": 0
        },
        "arm-front": {
          "rotation": 0
        },
        "forearm-front": {
          "rotation": 0
        },
        "arm-back": {
          "rotation": 0
        },
        "forearm-back": {
          "rotation": 0
        },
        "head": {
          "rotation": 0
        }
      }
    },
    {
      "frame": 16,
      "interpolation": "smoothstep",
      "pose": {
        "pelvis": {
          "x": 0,
          "y": 0,
          "rotation": 0
        },
        "leg-front": {
          "rotation": 0
        },
        "shin-front": {
          "rotation": 0
        },
        "leg-back": {
          "rotation": 0
        },
        "shin-back": {
          "rotation": 0
        },
        "torso": {
          "rotation": 0
        },
        "arm-front": {
          "rotation": 0
        },
        "forearm-front": {
          "rotation": 0
        },
        "arm-back": {
          "rotation": 0
        },
        "forearm-back": {
          "rotation": 0
        },
        "head": {
          "rotation": 0
        }
      }
    },
    {
      "frame": 24,
      "interpolation": "smoothstep",
      "pose": {
        "pelvis": {
          "x": 0,
          "y": 0,
          "rotation": 0
        },
        "leg-front": {
          "rotation": 0
        },
        "shin-front": {
          "rotation": 0
        },
        "leg-back": {
          "rotation": 0
        },
        "shin-back": {
          "rotation": 0
        },
        "torso": {
          "rotation": 0
        },
        "arm-front": {
          "rotation": 0
        },
        "forearm-front": {
          "rotation": 0
        },
        "arm-back": {
          "rotation": 0
        },
        "forearm-back": {
          "rotation": 0
        },
        "head": {
          "rotation": 0
        }
      }
    }
  ]
}
